<?xml version="1.0" encoding="UTF-8"?>
<xs:schema xmlns:xs="http://www.w3.org/2001/XMLSchema"
           targetNamespace="urn:vse:4iz238:chav07:sp:diet_tracker"
           xmlns="urn:vse:4iz238:chav07:sp:diet_tracker"
           elementFormDefault="qualified">

    <!-- Schema for diet_tracker XML -->
    <!-- Fill in the schema definitions here -->
    <xs:element name="diet_tracker" type="diet_tracker_type"/>
       
     <!-- Diet tracker type -->
    <xs:complexType name="diet_tracker_type">
        
        <xs:sequence>
            <xs:element name="user" type="user_type"/>
        </xs:sequence>
        <xs:attribute name="version" use="required" type="version_type"/>
        
    </xs:complexType>
    
    <!-- Version type -->
    <xs:simpleType name="version_type">
        <xs:annotation>
            <xs:documentation>
                The version must be in simplified SemVer major.minor format (i.e. 1.1, 3.2, etc.).
            </xs:documentation>
        </xs:annotation>
        <xs:restriction base="xs:string">
            <xs:pattern value="\d+\.\d+"/>
        </xs:restriction>
    </xs:simpleType>
    
    <!-- user type -->
    <xs:complexType name="user_type">
        <xs:sequence>
            <xs:element name="name" type="user_name_type"/>
            <xs:element name="email" type="user_email_type"/>
            <xs:element name="date_of_birth" type="xs:date"/>
            <xs:element name="sex" type="sex_type"/>
            <xs:element name="current_state" type="current_state_type"/>
            <xs:element name="long_term_goals" type="long_term_goals_type"/>
            <xs:element name="daily_logs" type="daily_logs_type"/>
        </xs:sequence> 
        <!-- user ID attribute -->
        <xs:attribute name="id" type="xs:nonNegativeInteger" use="required"/>
    </xs:complexType>
    
    <!-- user name type -->
    <xs:simpleType name="user_name_type">
        <xs:annotation>
            <xs:documentation>
                The name of the user. Must contain at least one non-whitespace character.
            </xs:documentation>
        </xs:annotation>
        <xs:restriction base="xs:string">
            <xs:pattern value=".*\S.*"/>
        </xs:restriction>
    </xs:simpleType>
    
    <!-- user email type -->
    <xs:simpleType name="user_email_type">
        <xs:restriction base="xs:string">
            <xs:pattern value="[A-Za-z0-9._%+-]+@[A-Za-z0-9.-]+\.[A-Za-z]{2,}"/>
        </xs:restriction>
    </xs:simpleType>
    
    <!-- sex type -->
    <xs:simpleType name="sex_type">
        <xs:restriction base="xs:string">
            <xs:enumeration value="male"/>
            <xs:enumeration value="female"/>
        </xs:restriction>
    </xs:simpleType>
    
    <!-- current state type -->
    <xs:complexType name="current_state_type">
        <xs:sequence>
            <xs:element name="height" type="height_type"/>
            <xs:element name="weight" type="weight_type"/>
        </xs:sequence>
    </xs:complexType>
    
    
    <!-- Height type -->
    <xs:simpleType name="height_type">
        <xs:annotation>
            <xs:documentation>
                Height in meters (m). Do NOT use unit prefixes. For example, enter 1.75 for 175cm.
            </xs:documentation>
        </xs:annotation>
        <xs:restriction base="xs:decimal">
            <xs:minInclusive value="0"/>
        </xs:restriction>
    </xs:simpleType>
    
    <!-- Weight type -->
    <xs:simpleType name="weight_type">
        <xs:annotation>
            <xs:documentation>
                Weight in grams (g). Do NOT use unit prefixes. For example, enter 75000 for 75kg.
            </xs:documentation>
        </xs:annotation>
        <xs:restriction base="xs:decimal">
            <xs:minInclusive value="0"/>
        </xs:restriction>
    </xs:simpleType>
    
    <!-- Energy type -->
    <xs:simpleType name="energy_type">
        <xs:annotation>
            <xs:documentation>
                Energy in joules (J). Do NOT use unit prefixes. For example, enter 8368000 for 2000kcal.
            </xs:documentation>
        </xs:annotation>
        <xs:restriction base="xs:decimal">
            <xs:minInclusive value="0"/>
        </xs:restriction>
    </xs:simpleType>
    
    <!-- Volume type -->
    <xs:simpleType name="volume_type">
        <xs:annotation>
            <xs:documentation>
                Volume in milliliters (mL). For example, enter 2000 for 2 liters of water.
            </xs:documentation>
        </xs:annotation>
        <xs:restriction base="xs:decimal">
            <xs:minInclusive value="0"/>
        </xs:restriction>
    </xs:simpleType>
    
    <!-- Mass type -->
    <xs:simpleType name="mass_type">
        <xs:annotation>
            <xs:documentation>
                Mass in grams (g). Used for macronutrients and other nutritional values.
            </xs:documentation>
        </xs:annotation>
        <xs:restriction base="xs:decimal">
            <xs:minInclusive value="0"/>
        </xs:restriction>
    </xs:simpleType>
    
    <!-- Micro mass type -->
    <xs:simpleType name="micro_mass_type">
        <xs:annotation>
            <xs:documentation>
                Mass in milligrams (mg). Used for micronutrients like calcium, sodium, etc.
            </xs:documentation>
        </xs:annotation>
        <xs:restriction base="xs:decimal">
            <xs:minInclusive value="0"/>
        </xs:restriction>
    </xs:simpleType>
    
    <!-- Long term goals type -->
    <xs:complexType name="long_term_goals_type">
        <xs:sequence>
            <xs:element name="weight" type="weight_type"/>
        </xs:sequence>
    </xs:complexType>
    
    <!-- daily logs type -->
    <xs:complexType name="daily_logs_type">
        <xs:sequence>
            <xs:element name="daily_log" type="daily_log_type" maxOccurs="unbounded" minOccurs="0"/>
        </xs:sequence>
    </xs:complexType>
    
    <!-- daily log type -->
    <xs:complexType name="daily_log_type">
        <xs:sequence>
            <xs:element name="daily_goal" type="daily_goal_type"/>
            <xs:element name="meals" type="meals_type"/>
        </xs:sequence>
        <xs:attribute name="date" type="xs:date" use="required"/>
    </xs:complexType>
    
    <!-- daily goal type -->
    <xs:complexType name="daily_goal_type">
        <xs:sequence>
            <xs:element name="energy" type="energy_type"/>
            <xs:element name="water" type="volume_type"/>
            <xs:element name="protein" type="mass_type"/>
            <xs:element name="carbohydrates" type="carbohydrates_type"/>
            <xs:element name="fats" type="fats_type"/>
            <xs:element name="cholesterol" type="micro_mass_type"/>
            <xs:element name="fiber" type="mass_type"/>
            <xs:element name="calcium" type="micro_mass_type"/>
            <xs:element name="sodium" type="micro_mass_type"/>
            <xs:element name="salt" type="mass_type"/>
            <xs:element name="phe" type="micro_mass_type"/>
        </xs:sequence>
    </xs:complexType>
    
    <!-- carbohydrates_type -->
    <xs:complexType name="carbohydrates_type">
        <xs:sequence>
            <xs:element name="total" type="mass_type"/>
            <xs:element name="sugars" type="mass_type"/>
        </xs:sequence>
    </xs:complexType>
    
    <!-- fats type -->
    <xs:complexType name="fats_type">
        <xs:sequence>
            <xs:element name="total" type="mass_type"/>
            <xs:element name="saturated_fats" type="mass_type"/>
            <xs:element name="trans_fats" type="mass_type" minOccurs="0"/>
            <xs:element name="monosaturated_fats" type="mass_type" minOccurs="0"/>
            <xs:element name="polysaturated_fats" type="mass_type" minOccurs="0"/>
        </xs:sequence>
    </xs:complexType>
    
    <!-- meals type -->
    <xs:complexType name="meals_type">
        <xs:sequence>
            <xs:element name="meal" type="meal_type" minOccurs="0" maxOccurs="unbounded"/>
        </xs:sequence>
    </xs:complexType>
    
    <!-- meal type -->
    <xs:complexType name="meal_type">
        <xs:sequence>
            <xs:element name="name" type="meal_name_type"/>
            <xs:element name="note" type="xs:string" minOccurs="0"/>
            <xs:element name="servings" type="servings_type"/>
            <xs:element name="ingredients" type="ingredients_type"/>
        </xs:sequence>
        <xs:attribute name="id" type="xs:nonNegativeInteger" use="required"/>
    </xs:complexType>
    
    <!-- meal name type -->
    <xs:simpleType name="meal_name_type">
        <xs:annotation>
            <xs:documentation>
                The name of the meal. Must contain at least one non-whitespace character.
            </xs:documentation>
        </xs:annotation>
        <xs:restriction base="xs:string">
            <xs:pattern value=".*\S.*"/>
        </xs:restriction>
    </xs:simpleType>
    
    <!-- serving type -->
    <xs:simpleType name="servings_type">
        <xs:restriction base="xs:decimal">
            <xs:minExclusive value="0"/>
        </xs:restriction>
    </xs:simpleType>
    
    <!-- ingredients type -->
    <xs:complexType name="ingredients_type">
        <xs:sequence>
            <xs:element name="ingredient" type="ingredient_type" maxOccurs="unbounded"/>
        </xs:sequence>
    </xs:complexType>
    
    <!-- ingredient type -->
    <xs:complexType name="ingredient_type">
        <xs:sequence>
            <xs:element name="name" type="ingredient_name_type"/>
            <xs:element name="brand" type="ingredient_brand_type" minOccurs="0"/>
            <xs:element name="serving" type="serving_type"/>
            <xs:element name="img" type="xs:anyURI"/>
            <xs:element name="base_values_per_100g" type="base_values_per_100g_type"/>
        </xs:sequence>
        <xs:attribute name="id" type="xs:nonNegativeInteger"/>
    </xs:complexType>
    
    <!-- ingredient name type -->
    <xs:simpleType name="ingredient_name_type">
        <xs:annotation>
            <xs:documentation>
                The name of the ingredient. It must contain at least one non-whitespace character.
            </xs:documentation>
        </xs:annotation>
        <xs:restriction base="xs:string">
            <xs:pattern value=".*\S.*"/>
        </xs:restriction>
    </xs:simpleType>
    
    <!-- ingredient brand type -->
    <xs:simpleType name="ingredient_brand_type">
        <xs:annotation>
            <xs:documentation>
                The brand of the ingredient. It must contain at least one non-whitespace character.
            </xs:documentation>
        </xs:annotation>
        <xs:restriction base="xs:string">
            <xs:pattern value=".*\S.*"/>
        </xs:restriction>
    </xs:simpleType>
    
    <!-- serving type -->
    <xs:complexType name="serving_type">
        <xs:annotation>
            <xs:documentation>
                Serving describes the amount of an ingredient and more useful details about the serving.
            </xs:documentation>
        </xs:annotation>
        <xs:sequence>
            <xs:element name="count" type="serving_count_type"/>
            <xs:element name="weight" type="weight_type"/>
            <xs:element name="specification" type="serving_specification_type" minOccurs="0"/>
        </xs:sequence>
    </xs:complexType>
    
    <!-- Serving count type -->
    <xs:simpleType name="serving_count_type">
        <xs:annotation>
            <xs:documentation>
                A unitless count representing the number of servings. Must be non-negative.
            </xs:documentation>
        </xs:annotation>
        <xs:restriction base="xs:decimal">
            <xs:minInclusive value="0"/>
        </xs:restriction>
    </xs:simpleType>
    
    <!-- serving specification type -->
    <xs:complexType name="serving_specification_type" mixed="true">
        <xs:annotation>
            <xs:documentation>
                Specification of the serving. It's an information to the user that makes it more clear how big is the serving.
            </xs:documentation>
        </xs:annotation>
        <xs:all>
            <xs:element name="size_category" type="xs:string"/>
        </xs:all>
    </xs:complexType>
    
    <xs:complexType name="base_values_per_100g_type">
        <xs:sequence>
            <xs:element name="energy" type="energy_type"/>
            <xs:element name="protein" type="mass_type" minOccurs="0"/>
            <xs:element name="carbohydrates" type="carbohydrates_type" minOccurs="0"/>
            <xs:element name="fats" type="fats_type" minOccurs="0"/>
            <xs:element name="cholesterol" type="micro_mass_type" minOccurs="0"/>
            <xs:element name="fiber" type="mass_type" minOccurs="0"/>
            <xs:element name="calcium" type="micro_mass_type" minOccurs="0"/>
            <xs:element name="sodium" type="micro_mass_type" minOccurs="0"/>
            <xs:element name="salt" type="mass_type" minOccurs="0"/>
            <xs:element name="water" type="mass_type" minOccurs="0"/>
            <xs:element name="phe" type="micro_mass_type" minOccurs="0"/>
        </xs:sequence>
    </xs:complexType>
    
</xs:schema>
